{
  "schema_version": "1.0",
  "generated_at": "2026-01-01T00:00:00+00:00",
  "label": "test fixture (virtual clock, deterministic)",
  "git_commit": null,
  "sdk_version": "0.1.0",
  "simulator_version": "1",
  "environment": {
    "python": "3.12",
    "implementation": "CPython",
    "platform": "fixture",
    "machine": "fixture",
    "cpu_count": 1,
    "ci": false
  },
  "measurement": {
    "clock": "virtual",
    "workload": "simulated",
    "latency_source": "virtual_clock_model",
    "notes": "Latencies come from a deterministic model; they are not measurements.",
    "cache_statistics": "simulated",
    "simulated_memory": "simulated KV-cache model; not a real measurement",
    "process_rss": "not collected"
  },
  "scenarios": [
    {
      "name": "baseline",
      "description": "Steady closed-loop load at moderate concurrency.",
      "group": null,
      "model": "demo-model",
      "runtime_version": "sim-1.0",
      "config": {
        "name": "baseline",
        "description": "Steady closed-loop load at moderate concurrency.",
        "group": null,
        "seed": 42,
        "model": "demo-model",
        "runtime_version": "sim-1.0",
        "num_requests": 30,
        "concurrency": 8,
        "arrival_rate_rps": 0.0,
        "prompt_tokens": {
          "mean": 512,
          "stddev": 128,
          "min": 16,
          "max": 4096
        },
        "generated_tokens": {
          "mean": 64,
          "stddev": 16,
          "min": 1,
          "max": 1024
        },
        "scheduler_delay_ms": {
          "mean": 1.0,
          "stddev": 0.5,
          "min": 0.0,
          "max": 50.0
        },
        "prefill_base_ms": 4.0,
        "prefill_ms_per_token": 0.04,
        "first_token_overhead_ms": 2.0,
        "inter_token_ms": {
          "mean": 6.0,
          "stddev": 1.0,
          "min": 0.5,
          "max": 100.0
        },
        "batch_contention": 0.05,
        "failure_rate": 0.0,
        "cancel_rate": 0.0,
        "cache": {
          "enabled": true,
          "capacity_entries": 256,
          "prefix_pool": 64,
          "prefix_skew": 2.0,
          "hit_prefill_fraction": 0.3,
          "lookup_ms": 0.2,
          "insert_ms": 0.3,
          "evict_ms": 0.1
        },
        "memory": {
          "bytes_per_token": 131072,
          "capacity_bytes": 8589934592,
          "pressure_threshold": 0.9,
          "pressure_slowdown": 1.5,
          "real_allocation_mb": 0
        },
        "regression": {
          "prefill_multiplier": 1.0,
          "inter_token_multiplier": 1.0,
          "queue_delay_add_ms": 0.0,
          "first_token_add_ms": 0.0
        },
        "time_scale": 1.0
      },
      "regression_injected": false,
      "concurrency": 8,
      "duration_s": 2.350984,
      "requests": {
        "total": 30,
        "completed": 30,
        "failed": 0,
        "cancelled": 0,
        "error_rate": 0.0
      },
      "tokens": {
        "prompt_total": 14528,
        "generated_total": 1964,
        "prompt_mean": 484.267
      },
      "throughput": {
        "requests_per_second": 12.7606,
        "generated_tokens_per_second": 835.3948,
        "per_request_tokens_per_second": {
          "count": 30,
          "min": 120.8603,
          "mean": 125.6853,
          "stddev": 3.566,
          "p50": 125.0772,
          "p90": 129.3593,
          "p95": 131.4923,
          "p99": 136.8279,
          "max": 138.7445
        }
      },
      "latency_ms": {
        "end_to_end": {
          "count": 30,
          "min": 183.2323,
          "mean": 543.0802,
          "stddev": 141.5691,
          "p50": 514.6421,
          "p90": 735.3586,
          "p95": 767.5181,
          "p99": 801.6278,
          "max": 812.138
        },
        "queue": {
          "count": 30,
          "min": 0.0,
          "mean": 0.9892,
          "stddev": 0.5375,
          "p50": 1.0711,
          "p90": 1.7528,
          "p95": 1.8176,
          "p99": 1.8818,
          "max": 1.891
        },
        "prefill": {
          "count": 30,
          "min": 5.064,
          "mean": 18.6751,
          "stddev": 8.6718,
          "p50": 19.18,
          "p90": 29.704,
          "p95": 31.528,
          "p99": 33.8344,
          "max": 34.6
        },
        "time_to_first_token": {
          "count": 30,
          "min": 7.8417,
          "mean": 21.8643,
          "stddev": 8.7407,
          "p50": 22.1726,
          "p90": 33.5358,
          "p95": 34.58,
          "p99": 37.7048,
          "max": 38.6593
        },
        "generation": {
          "count": 30,
          "min": 165.7723,
          "mean": 522.9959,
          "stddev": 141.4615,
          "p50": 496.1831,
          "p90": 709.1391,
          "p95": 742.6546,
          "p99": 787.0312,
          "max": 802.847
        },
        "inter_token": {
          "count": 1934,
          "min": 2.4579,
          "mean": 8.0816,
          "stddev": 1.3739,
          "p50": 8.0557,
          "p90": 9.8775,
          "p95": 10.3443,
          "p99": 11.2481,
          "max": 13.0701
        }
      },
      "cache": {
        "enabled": true,
        "lookups": 30,
        "hits": 8,
        "misses": 22,
        "insertions": 22,
        "evictions": 0,
        "hit_ratio": 0.266667,
        "eviction_ratio": 0.0,
        "simulated": true
      },
      "memory": {
        "process_rss": null,
        "simulated_kv_cache": {
          "peak_bytes": 735313920,
          "capacity_bytes": 8589934592,
          "peak_pressure": 0.085602,
          "requests_slowed_by_pressure": 0,
          "simulated": true
        }
      },
      "errors": []
    }
  ],
  "instrumentation_overhead": null
}
